{
  "opdracht_uri": "https://grip.opdrachtgever.example/id/opdracht/3f2a8c54-6d1b-4f0e-9a77-1c2b3d4e5f60",
  "status": "in_uitvoering",
  "peilmoment": "2026-09-30",
  "samenvatting": "Eerste versie opgeleverd.",
  "mijlpalen": [
    {
      "omschrijving": "Eerste versie",
      "streefdatum": "2026-09-15",
      "stand": "gereed"
    },
    {
      "omschrijving": "Tweede versie",
      "streefdatum": null,
      "stand": "gepland"
    }
  ],
  "geleverd": [
    "Eerste versie"
  ],
  "niet_geleverd": []
}
